{
 "refId": "fitting-dimensions",
 "version": "1.2.0",
 "source": "ASME B16.9-2018, Factory-Made Wrought Buttwelding Fittings, Tables 6.1-1 and 6.1-10 (SI). Transcribed from a purchased copy held outside version control.",
 "note": "The other half of closing an isometric. B16.10 gave the length of a valve; this gives the take-out of an elbow, which is what actually sets the cut length of the pipe between two of them.",
 "units": {
  "length": "mm"
 },
 "conventions": {
  "aButtweldingFittingHasNoClass": "Clause 1.5: \"Fitting pressure rating is associated with the connecting wall thickness of pipe of equivalent size and material.\" Clause 2.1: the allowable pressure \"may be calculated as for straight seamless pipe of equivalent material ... in accordance with ASME B31\". A butt-welding fitting therefore carries NO pressure class of its own - it is rated as the pipe it is welded to, and for this platform that calculation is the B31.3 chain in WallThickness and AllowableStress. Asking a PMS row for an elbow rating is asking for something the standard does not issue.",
  "keyedOnOutsideDiameter": "Rows are keyed on the outside diameter at bevel and the NPS recovered from pipe-sizes, because the size column suffers the vulgar-fraction split that has bitten every dimensional standard read here: \"1 1/4\" arrives as a bare \"1\" on one line and \"1/4\" on the next.",
  "theRuleAndItsFloor": "A long radius elbow is 1.5 x NPS centre to end and a 45 degree one is 0.625 x NPS - which is how these figures were checked rather than trusted. The rule does NOT hold at the small end: B16.9 sets a FLOOR, so an NPS 1/2 and an NPS 3/4 long radius elbow are both 38 mm (1.50 in) where the rule would give 19 and 29. The floor is the standard, not a transcription fault, and a consumer that computes 1.5 x NPS instead of reading the table will under-dimension every small elbow on the drawing.",
  "centreToEndNotLength": "An elbow is measured CENTRE TO END, not end to end: the dimension runs from the intersection of the two centrelines to the welding bevel. Treating it as a length makes every spool between two elbows short by twice the radius.",
  "capLengthApplicability": "Table 6.1-10 notes (1)/(2): for NPS 1/2 through 24 select E/E1 from explicitly sourced specified thickness. NPS 26 through 48 are WITHIN B16.9 coverage: E is tabulated but its thickness threshold and E1 are not. E1 requires manufacturer/purchaser agreement; do not choose E by assuming a missing threshold means infinity, or infer E1.",
  "capSourceReview": "Threshold and E1 cells cross-checked against the user-supplied ASME B16.9-2018 PDF, SHA-256 f254b756cf54dc4115fba10c659f205cee913c816068736ee76f59b608052ab4; printed page 20 / PDF page 31. This is a limited transcription review, not engineering certification.",
  "sizeScope": "B16.9-2018 clause 1.1: NPS 1/2 through 48. Reference ingestion gaps do not narrow this range. Outside this range, the user must define dimensions according to the project specification, with separate project provenance, not B16.9 extrapolation."
 },
 "standard": {
  "code": "B16.9",
  "editionYear": 2018,
  "title": "Factory-Made Wrought Buttwelding Fittings",
  "sourceTables": [
   "Table 6.1-1",
   "Table 6.1-10"
  ]
 },
 "verified": true,
 "readOn": "2026-09-28",
 "dimensions": [
  {
   "fitting": "CAP",
   "qualifier": null,
   "nps": "1/2",
   "dn": 15,
   "odMm": 21.3,
   "dimension": "LENGTH",
   "symbol": "E",
   "mm": 25.0,
   "sourceTable": "Table 6.1-10",
   "limitingWallThicknessMm": 4.57,
   "e1Mm": 25.0,
   "requiresManufacturerAgreement": false
  },
  {
   "fitting": "CAP",
   "qualifier": null,
   "nps": "3/4",
   "dn": 20,
   "odMm": 26.7,
   "dimension": "LENGTH",
   "symbol": "E",
   "mm": 25.0,
   "sourceTable": "Table 6.1-10",
   "limitingWallThicknessMm": 3.81,
   "e1Mm": 25.0,
   "requiresManufacturerAgreement": false
  },
  {
   "fitting": "CAP",
   "qualifier": null,
   "nps": "1",
   "dn": 25,
   "odMm": 33.4,
   "dimension": "LENGTH",
   "symbol": "E",
   "mm": 38.0,
   "sourceTable": "Table 6.1-10",
   "limitingWallThicknessMm": 4.57,
   "e1Mm": 38.0,
   "requiresManufacturerAgreement": false
  },
  {
   "fitting": "CAP",
   "qualifier": null,
   "nps": "1 1/4",
   "dn": 32,
   "odMm": 42.2,
   "dimension": "LENGTH",
   "symbol": "E",
   "mm": 38.0,
   "sourceTable": "Table 6.1-10",
   "limitingWallThicknessMm": 4.83,
   "e1Mm": 38.0,
   "requiresManufacturerAgreement": false
  },
  {
   "fitting": "CAP",
   "qualifier": null,
   "nps": "1 1/2",
   "dn": 40,
   "odMm": 48.3,
   "dimension": "LENGTH",
   "symbol": "E",
   "mm": 38.0,
   "sourceTable": "Table 6.1-10",
   "limitingWallThicknessMm": 5.08,
   "e1Mm": 38.0,
   "requiresManufacturerAgreement": false
  },
  {
   "fitting": "CAP",
   "qualifier": null,
   "nps": "2",
   "dn": 50,
   "odMm": 60.3,
   "dimension": "LENGTH",
   "symbol": "E",
   "mm": 38.0,
   "sourceTable": "Table 6.1-10",
   "limitingWallThicknessMm": 5.59,
   "e1Mm": 44.0,
   "requiresManufacturerAgreement": false
  },
  {
   "fitting": "CAP",
   "qualifier": null,
   "nps": "2 1/2",
   "dn": 65,
   "odMm": 73.0,
   "dimension": "LENGTH",
   "symbol": "E",
   "mm": 38.0,
   "sourceTable": "Table 6.1-10",
   "limitingWallThicknessMm": 7.11,
   "e1Mm": 51.0,
   "requiresManufacturerAgreement": false
  },
  {
   "fitting": "CAP",
   "qualifier": null,
   "nps": "3",
   "dn": 80,
   "odMm": 88.9,
   "dimension": "LENGTH",
   "symbol": "E",
   "mm": 51.0,
   "sourceTable": "Table 6.1-10",
   "limitingWallThicknessMm": 7.62,
   "e1Mm": 64.0,
   "requiresManufacturerAgreement": false
  },
  {
   "fitting": "CAP",
   "qualifier": null,
   "nps": "3 1/2",
   "dn": 90,
   "odMm": 101.6,
   "dimension": "LENGTH",
   "symbol": "E",
   "mm": 64.0,
   "sourceTable": "Table 6.1-10",
   "limitingWallThicknessMm": 8.13,
   "e1Mm": 76.0,
   "requiresManufacturerAgreement": false
  },
  {
   "fitting": "CAP",
   "qualifier": null,
   "nps": "4",
   "dn": 100,
   "odMm": 114.3,
   "dimension": "LENGTH",
   "symbol": "E",
   "mm": 64.0,
   "sourceTable": "Table 6.1-10",
   "limitingWallThicknessMm": 8.64,
   "e1Mm": 76.0,
   "requiresManufacturerAgreement": false
  },
  {
   "fitting": "CAP",
   "qualifier": null,
   "nps": "5",
   "dn": 125,
   "odMm": 141.3,
   "dimension": "LENGTH",
   "symbol": "E",
   "mm": 76.0,
   "sourceTable": "Table 6.1-10",
   "limitingWallThicknessMm": 9.65,
   "e1Mm": 89.0,
   "requiresManufacturerAgreement": false
  },
  {
   "fitting": "CAP",
   "qualifier": null,
   "nps": "6",
   "dn": 150,
   "odMm": 168.3,
   "dimension": "LENGTH",
   "symbol": "E",
   "mm": 89.0,
   "sourceTable": "Table 6.1-10",
   "limitingWallThicknessMm": 10.92,
   "e1Mm": 102.0,
   "requiresManufacturerAgreement": false
  },
  {
   "fitting": "CAP",
   "qualifier": null,
   "nps": "8",
   "dn": 200,
   "odMm": 219.1,
   "dimension": "LENGTH",
   "symbol": "E",
   "mm": 102.0,
   "sourceTable": "Table 6.1-10",
   "limitingWallThicknessMm": 12.7,
   "e1Mm": 127.0,
   "requiresManufacturerAgreement": false
  },
  {
   "fitting": "CAP",
   "qualifier": null,
   "nps": "10",
   "dn": 250,
   "odMm": 273.0,
   "dimension": "LENGTH",
   "symbol": "E",
   "mm": 127.0,
   "sourceTable": "Table 6.1-10",
   "limitingWallThicknessMm": 12.7,
   "e1Mm": 152.0,
   "requiresManufacturerAgreement": false
  },
  {
   "fitting": "CAP",
   "qualifier": null,
   "nps": "12",
   "dn": 300,
   "odMm": 323.8,
   "dimension": "LENGTH",
   "symbol": "E",
   "mm": 152.0,
   "sourceTable": "Table 6.1-10",
   "limitingWallThicknessMm": 12.7,
   "e1Mm": 178.0,
   "requiresManufacturerAgreement": false
  },
  {
   "fitting": "CAP",
   "qualifier": null,
   "nps": "14",
   "dn": 350,
   "odMm": 355.6,
   "dimension": "LENGTH",
   "symbol": "E",
   "mm": 165.0,
   "sourceTable": "Table 6.1-10",
   "limitingWallThicknessMm": 12.7,
   "e1Mm": 191.0,
   "requiresManufacturerAgreement": false
  },
  {
   "fitting": "CAP",
   "qualifier": null,
   "nps": "16",
   "dn": 400,
   "odMm": 406.4,
   "dimension": "LENGTH",
   "symbol": "E",
   "mm": 178.0,
   "sourceTable": "Table 6.1-10",
   "limitingWallThicknessMm": 12.7,
   "e1Mm": 203.0,
   "requiresManufacturerAgreement": false
  },
  {
   "fitting": "CAP",
   "qualifier": null,
   "nps": "18",
   "dn": 450,
   "odMm": 457.0,
   "dimension": "LENGTH",
   "symbol": "E",
   "mm": 203.0,
   "sourceTable": "Table 6.1-10",
   "limitingWallThicknessMm": 12.7,
   "e1Mm": 229.0,
   "requiresManufacturerAgreement": false
  },
  {
   "fitting": "CAP",
   "qualifier": null,
   "nps": "20",
   "dn": 500,
   "odMm": 508.0,
   "dimension": "LENGTH",
   "symbol": "E",
   "mm": 229.0,
   "sourceTable": "Table 6.1-10",
   "limitingWallThicknessMm": 12.7,
   "e1Mm": 254.0,
   "requiresManufacturerAgreement": false
  },
  {
   "fitting": "CAP",
   "qualifier": null,
   "nps": "22",
   "dn": 550,
   "odMm": 559.0,
   "dimension": "LENGTH",
   "symbol": "E",
   "mm": 254.0,
   "sourceTable": "Table 6.1-10",
   "limitingWallThicknessMm": 12.7,
   "e1Mm": 254.0,
   "requiresManufacturerAgreement": false
  },
  {
   "fitting": "CAP",
   "qualifier": null,
   "nps": "24",
   "dn": 600,
   "odMm": 610.0,
   "dimension": "LENGTH",
   "symbol": "E",
   "mm": 267.0,
   "sourceTable": "Table 6.1-10",
   "limitingWallThicknessMm": 12.7,
   "e1Mm": 305.0,
   "requiresManufacturerAgreement": false
  },
  {
   "fitting": "CAP",
   "qualifier": null,
   "nps": "26",
   "dn": 650,
   "odMm": 660.0,
   "dimension": "LENGTH",
   "symbol": "E",
   "mm": 267.0,
   "sourceTable": "Table 6.1-10",
   "limitingWallThicknessMm": null,
   "e1Mm": null,
   "requiresManufacturerAgreement": true
  },
  {
   "fitting": "CAP",
   "qualifier": null,
   "nps": "28",
   "dn": 700,
   "odMm": 711.0,
   "dimension": "LENGTH",
   "symbol": "E",
   "mm": 267.0,
   "sourceTable": "Table 6.1-10",
   "limitingWallThicknessMm": null,
   "e1Mm": null,
   "requiresManufacturerAgreement": true
  },
  {
   "fitting": "CAP",
   "qualifier": null,